{
  "schema_version": "2.1.0",
  "opportunity_id": "us-061-P01",
  "place_id": "us-061",
  "revision": 1,
  "lifecycle_status": "draft",
  "name_i18n": {
    "zh-TW": "Fort Abercrombie・海蝕峭壁／雲杉海岸景觀",
    "en": "Fort Abercrombie・海蝕峭壁／雲杉海岸景觀 (provisional English title, pending review)",
    "ja": "Fort Abercrombie・海蝕峭壁／雲杉海岸景觀（暫定日本語タイトル、レビュー待ち）"
  },
  "description_i18n": {
    "zh-TW": "Fort Abercrombie・海蝕峭壁／雲杉海岸景觀（V1 遷移骨架；內容待第二輪研究完善。）",
    "en": "Fort Abercrombie・海蝕峭壁／雲杉海岸景觀 (V1 migration skeleton; content to be refined in round 2.)",
    "ja": "Fort Abercrombie・海蝕峭壁／雲杉海岸景觀（V1移行スケルトン。内容は第2ラウンドで精緻化予定。）"
  },
  "camera_contexts": [
    {
      "id": "CZ-us-061-P01-01",
      "kind": "area",
      "geometry": {
        "kind": "point",
        "status": "provisional",
        "geojson": {
          "type": "Point",
          "coordinates": [
            -152.35664,
            57.82759
          ]
        },
        "uncertainty_m": null,
        "derivation_method": "imported_from_v1_viewpoint_reference",
        "source_geometry_revision": null,
        "reason_if_absent": null
      },
      "verification_status": "provisional",
      "evidence_refs": [],
      "access_notes_i18n": {
        "zh-TW": "存取資訊尚未核實；請依現場公告與規定。",
        "en": "Access information not yet verified; follow on-site notices and rules.",
        "ja": "アクセス情報は未確認。現地の告知と規定に従ってください。"
      },
      "safety_notes_i18n": {
        "zh-TW": "請依現場安全指示行動。",
        "en": "Follow on-site safety guidance.",
        "ja": "現地の安全指示に従ってください。"
      },
      "altitude_m": null
    }
  ],
  "targets": [
    {
      "id": "SG-us-061-P01-01",
      "kind": "multi_component",
      "name_i18n": {
        "zh-TW": "Fort Abercrombie・海蝕峭壁／雲杉海岸景觀",
        "en": "Fort Abercrombie・海蝕峭壁／雲杉海岸景觀 (provisional English title, pending review)",
        "ja": "Fort Abercrombie・海蝕峭壁／雲杉海岸景觀（暫定日本語タイトル、レビュー待ち）"
      },
      "geometry": {
        "kind": "point",
        "status": "provisional",
        "geojson": {
          "type": "Point",
          "coordinates": [
            -152.35664,
            57.82759
          ]
        },
        "uncertainty_m": null,
        "derivation_method": "imported_from_v1_viewpoint_reference",
        "source_geometry_revision": null,
        "reason_if_absent": null
      },
      "phenomenon_model_id": null,
      "evidence_refs": [],
      "components": []
    }
  ],
  "observation_relations": [
    {
      "id": "VR-us-061-P01-01",
      "camera_context_id": "CZ-us-061-P01-01",
      "target_id": "SG-us-061-P01-01",
      "type": "foreground_background",
      "geometry_mode": "unknown",
      "azimuth_deg": null,
      "elevation_deg": null,
      "distance_m": null,
      "evidence_refs": [],
      "derivation_method": null,
      "uncertainty_note": "Imported V1 reference; angles and distance unknown."
    }
  ],
  "navigation_targets": [
    {
      "id": "NAV-us-061-P01-01",
      "status": "needs_review",
      "target_type": "other",
      "lat": 57.82759,
      "lon": -152.35664,
      "label_i18n": {
        "zh-TW": "實際抵達點尚未核實",
        "en": "Practical arrival point not verified",
        "ja": "実際の到着地点は未確認"
      },
      "evidence_refs": [],
      "confidence": "low"
    }
  ],
  "condition_contract": {
    "contract_id": "CC-us-061-P01-v1",
    "status": "draft",
    "conditions": [
      {
        "id": "C-us-061-P01-01",
        "role": "REQUIRED",
        "domain": "ASTRONOMY",
        "evaluation_mode": "GUIDANCE",
        "capability": "CONDITIONS",
        "metric": "legacy_mountain_view",
        "operator": "none",
        "threshold": null,
        "unit": null,
        "unknown_policy": "propagate_unknown",
        "claim_refs": [
          "us-061-P01-claim-01"
        ],
        "model_binding": null,
        "notes_i18n": {
          "zh-TW": "由 V1 主題對應的暫定條件；實際閾值待研究核實。",
          "en": "Provisional condition mapped from the V1 theme; thresholds pending research.",
          "ja": "V1テーマから対応した暫定条件。閾値は研究待ち。"
        },
        "validation_status": "provisional"
      }
    ],
    "recommendation_policy_version": null
  },
  "evidence_claims": [
    {
      "claim_id": "us-061-P01-claim-01",
      "claim_type": "existence",
      "evidence_refs": [],
      "audit_status": "UNKNOWN",
      "scope_note": "Skeleton import from V1 catalog; no independent evidence attached yet."
    }
  ],
  "readiness": {
    "research_level": "R0",
    "gaps": [
      "RESEARCH_GAP",
      "GEOMETRY_GAP"
    ]
  },
  "provenance": {
    "source_catalog": "runtime_catalog_v004_r4_2.json",
    "source_revision": "v1-spot-us-061",
    "imported_at": "2026-10-22T12:15:58Z",
    "review_status": "pending",
    "reviewed_by": null
  }
}
